{"accounted":[],"accounted_bytes":0,"capture_generation_ref":"sha256:e81d44ae6a0cadbb401b3cb8ba2fb160f34c77ffce81c87cd53356ffd0636531","coordinate_system":"decoded_utf8","eligible_bytes":3,"instrument_version":"parser-rq-source-recognition-v1","ledger":{"bytes":1039,"locator":"sha256/82/8210c83f4a14f592808ebf61deebf0d53076e99f30e2b2faefee87bf5e19b53a.json","media_type":"application/json","sha256":"sha256:8210c83f4a14f592808ebf61deebf0d53076e99f30e2b2faefee87bf5e19b53a"},"policy_hash":"sha256:defc1c9bd3ac7a3a3ce63ea4aae6948698b37d4de8071d6b3ac66176984b980a","qualification_identity_ref":"sha256:f92620fc831d02ea21cb506bdff56b778312b746c131fd298c2ceaf7390e9dd8","recognized":[],"recognized_bytes":0,"schema_version":"abc/parser-rq-source-recognition-work/v1","semantic_gap_bytes":3,"semantic_gaps":[{"end":3,"start":0}],"status":"ok","unaccounted":[{"end":3,"start":0}],"unaccounted_bytes":3,"work_id":"sha256:5af0acca57065538ce20fc8615fdc9f2eb55664a4a8201649ea88188217db540"}