{"accounted":[{"end":7,"start":0}],"accounted_bytes":7,"capture_generation_ref":"sha256:4eb4c2acb1d5668a889ea6311924223640c609023f26d7487cf14eba1c2506e4","coordinate_system":"decoded_utf8","eligible_bytes":7,"instrument_version":"parser-rq-source-recognition-v1","ledger":{"bytes":1750,"locator":"sha256/9b/9b271d04b2fe4b5fe7902f4690a6eb4d193d333b7536456c7048b1cf531a6ac9.json","media_type":"application/json","sha256":"sha256:9b271d04b2fe4b5fe7902f4690a6eb4d193d333b7536456c7048b1cf531a6ac9"},"policy_hash":"sha256:defc1c9bd3ac7a3a3ce63ea4aae6948698b37d4de8071d6b3ac66176984b980a","qualification_identity_ref":"sha256:c516f78850fa7119ac7e847793f2544a1ef87ce7ee8f529d1d22b09121ef4169","recognized":[{"end":7,"start":0}],"recognized_bytes":7,"schema_version":"abc/parser-rq-source-recognition-work/v1","semantic_gap_bytes":0,"semantic_gaps":[],"status":"ok","unaccounted":[],"unaccounted_bytes":0,"work_id":"sha256:6b2676d80da84264c9c704f58ab4ba961651f6e4de14d639e54431c44fd5da8e"}