{"accounted":[{"end":18,"start":0}],"accounted_bytes":18,"capture_generation_ref":"sha256:d669b152fa144272f7db6744103cff18d3f45364273c4e4ffb490be16eb4c83c","coordinate_system":"decoded_utf8","eligible_bytes":18,"instrument_version":"parser-rq-source-recognition-v1","ledger":{"bytes":1795,"locator":"sha256/01/0195ef13c289fa148142157e05aef16887e314988ea68e8d141c4fc8836ee819.json","media_type":"application/json","sha256":"sha256:0195ef13c289fa148142157e05aef16887e314988ea68e8d141c4fc8836ee819"},"policy_hash":"sha256:defc1c9bd3ac7a3a3ce63ea4aae6948698b37d4de8071d6b3ac66176984b980a","qualification_identity_ref":"sha256:0cdbd4e18072cf0693cbc2626e29d89bd2fa88d3b2f9fb78c1de173cab1164d2","recognized":[{"end":18,"start":6}],"recognized_bytes":12,"schema_version":"abc/parser-rq-source-recognition-work/v1","semantic_gap_bytes":6,"semantic_gaps":[{"end":6,"start":0}],"status":"ok","unaccounted":[],"unaccounted_bytes":0,"work_id":"sha256:301f9791d9dc70e40ed954376996776f019d8bf447a4c328e980c2de1f9f94b9"}